index,uri
"siren 042, lala lala",spotify:track:75nN4kH1uzSsUdMrdUVfrq
"make me a song, eleanor friedberger",spotify:track:71GBQ7iVnffAGkNuTDxCoH
"uprising, muse",spotify:track:4VqPOruhp5EdPBeR92t6lQ
"time is running out, muse",spotify:track:2takcwOaAZWiXQijPHIx7B
"knights of cydonia, muse",spotify:track:7ouMYWpwJ422jRcDASZB7P
"vicious, lou reed",spotify:track:4A48NL57P16zSRaq3yoYry
"like a hurricane - 2017 remaster, neil young",spotify:track:1n6gDSllAqVSweuFD82hNH
"smile like you mean it, the killers",spotify:track:4kAgnAL4WKx7YqnlL2fvMh
"season of the witch, donovan",spotify:track:6MOEQCtAWNSCmvg3SFKF5y
"harvest moon, neil young",spotify:track:5l9c6bJmzvftumhz4TMPgk
"canopée, polo & pan",spotify:track:260V7huyJrXnyYe0dFv2Fa
"saat vayse, zedbazi",spotify:track:2VAXA5gR66Afn5ZIMZSp7n
"les bateaux, pépite",spotify:track:0TFbOsnKJ6c6WQjBvhZwsi
"free, cat power",spotify:track:6GJZaic4HSan2B2jgvI2L4
"beginning to see the light - closet mix, the velvet underground",spotify:track:248yl9Wbn6b7rb3Z5jKBbL
"new age - live from the matrix, san francisco, ca / 1969, the velvet underground",spotify:track:2dx4ARjTXNK0xALBEOSwG4
"rock and roll - live from the matrix, san francisco, ca / 1969, the velvet underground",spotify:track:1frf0XWnMowpEYeNHIOCQh
"ocean - live from the matrix, san francisco, ca / 1969, the velvet underground",spotify:track:68ry0Tqwy66bCBOjNu6VKQ
"pale blue eyes - closet mix, the velvet underground",spotify:track:7BJ8zZRpcFlRd79NEk2i1V
"hey mr. rain - version one, the velvet underground",spotify:track:2oZnL37Fz8bL4ANpJr8QYq
"it was a pleasure then, nico",spotify:track:1NIPccr0kY8XNg6yds1U8a
"chelsea girls, nico",spotify:track:1WJjqHx6agqO2vrhkJPCjp
"jack & jane, the velvet underground",spotify:track:6KDBCw8UZpZFSOYU64YChH
"wordless, the velvet underground",spotify:track:3Lc4EFhwaxUQg9IdfL3PZ6
"send no letter, the velvet underground",spotify:track:5lctbHcYWfgCae10dgVc2A
"caroline, the velvet underground",spotify:track:5sdoJNRJh1Vbr6qYk1solp
"mean old man, the velvet underground",spotify:track:5cYnwvde4Z5UE9lvhnUv0q
"little jack, the velvet underground",spotify:track:0tMbZfyqgUjp1iHg9xOWHv
"crash, the velvet underground",spotify:track:0hQ5ZtNq6lpGhnLNIuvBNu
"new age, the velvet underground",spotify:track:3TS0PSEGYcvQWVPeK2DrWi
"sweet jane - live from the matrix, san francisco, ca / 1969, the velvet underground",spotify:track:4Ix141y9rAazV5xUVr0VeS
"waiting for the man, the velvet underground",spotify:track:23i8helR1qRsqTx0WJXxWu
"ocean, the velvet underground",spotify:track:4YnQESBmgiYcmKXRzSfjy5
"rock and roll, the velvet underground",spotify:track:5LI786WjVfUnUeZBPQowtt
"ferryboat bill, the velvet underground",spotify:track:5qj3EQB2KcldueyW8PTKyL
"coney island steeplechase, the velvet underground",spotify:track:5WYFLOqHjy9cWeHj4kbOzZ
"ride into the sun, the velvet underground",spotify:track:05sabuHmgGSO7zFn1Q6Zct
"we're gonna have a real good time together, the velvet underground",spotify:track:37FUkyxKdVG5QQS3F3OZTi
"beginning to see the light - early version, the velvet underground",spotify:track:6T1heqJlWih0KsY5Gja634
"hey mr. rain - version 2, the velvet underground",spotify:track:3kH9s21zATtB3xX69rH3ap
"hey mr. rain - version 1, the velvet underground",spotify:track:3B3rITFY4UAb1C0BUvIxt2
"temptation inside your heart, the velvet underground",spotify:track:7yexycwAnU6Sq4qD7aO8yf
"guess i'm falling in love - instrumental version, the velvet underground",spotify:track:4BywdhVkXOz5m9FLL3b9aM
"i heard her call my name - alternate take, the velvet underground",spotify:track:1GXcim081lF4LggGbCyYkO
"sweet jane - live, the velvet underground",spotify:track:08gy68MItzkU63qIOkORO1
"heroin - live, the velvet underground",spotify:track:1pwGU2tMwClYkioywE00dG
"white light/white heat - live, the velvet underground",spotify:track:7FO4rdfNpOtb1uVfjHq4yR
"pale blue eyes - live, the velvet underground",spotify:track:3zKB4gETD1nRBOsrln0ipX
"i can't stand it anymore - live, the velvet underground",spotify:track:29gsBHJ8Q6FdMgls604ctM
"rock and roll - live, the velvet underground",spotify:track:6AkIGtaVYaAV9cH7nij7Ik
"beginning to see the light - live, the velvet underground",spotify:track:2BfOWnBbvyehmbddtlaQSu
"some kinda love - live, the velvet underground",spotify:track:5mXUiUafngoR5SaRJI12iQ
"i'm waiting for the man - live, the velvet underground",spotify:track:7DIKG9V26KzgizzTDGt8gf
"what goes on - live, the velvet underground",spotify:track:5quC6i10rcX20eIL2khEGW
"loulou, juliette armanet",spotify:track:5CYToYaOPopPwNjRxE4kHE
"la nuit, juliette armanet",spotify:track:4ciRSTM3OxACHI06DHKYKT
"petite amie, juliette armanet",spotify:track:6chhcVHedK27qBasjJflJ0
"l'accident, juliette armanet",spotify:track:016NAcm7HFfldZabbMVaz7
"la carte postale, juliette armanet",spotify:track:1cgS8NpgrgBJ4Fw00YsQsi
"star triste, juliette armanet",spotify:track:69Ls5gctPKdaEs6JwrvVa8
"un samedi soir dans l'histoire, juliette armanet",spotify:track:47vIeQiipUPTjtJ0AJqGny
"a la guerre comme à l'amour, juliette armanet",spotify:track:3TdkzBnPxo7PmmCxBuB0Oy
"cavalier seule, juliette armanet",spotify:track:2etychqYY0AjmR2K8c3in5
"à la folie - rework, juliette armanet",spotify:track:12MkoPwvLI3OXRpBAoMkeK
"l’amour en solitaire, juliette armanet",spotify:track:2oBqyhYfeaHzMx5OtQ2mLM
"cool cat, juliette armanet",spotify:track:3Zv9r86H4TdZ42xyes7fK0
"sous la pluie, juliette armanet",spotify:track:6sktd1Utvi1i6riHrrISEC
"alexandre, juliette armanet",spotify:track:3NLjKDOSB2APFv7ICJqizh
"manque d'amour, juliette armanet",spotify:track:7d8TyewztC4p7naRZlPFDe
"corail, julien doré",spotify:track:1g9ug4uU0UPPw5aksdPqLL
"une nuit sur son épaule, véronique sanson",spotify:track:6REJcW4CZ0M3bTXcKwjZlk
"boule de flipper, christophe",spotify:track:26yt1KqTB1gAZxjTPNzZvl
"l'indien, juliette armanet",spotify:track:5IefSLC7yzmpE022dqiQz3
"a la folie, juliette armanet",spotify:track:2J9GcefkuKfHBl7DOMkyBq
"l'amour en solitaire, juliette armanet",spotify:track:2u3TwrQM6F3tg2yA6jqzjK
"no harm is done (feat. tunji ige), christine and the queens",spotify:track:2lLBjbwfxyQEb32rwTyxYC
"here, christine and the queens",spotify:track:4Cu2diaJZL5VJo5y4hHoc1
"science fiction, christine and the queens",spotify:track:176q92Z8Pn9FCm3cXjgJ7l
"wandering lovers, christine and the queens",spotify:track:7h1MnX7EqVXmsMgJvwnnP1
"ugly-pretty, christine and the queens",spotify:track:0CgeuA8OaptZ8QYawlVtHv
"the loving cup, christine and the queens",spotify:track:0angJqIeTakolJdvoNpAtg
"starshipper, christine and the queens",spotify:track:5gjPREYn4RBknUWZXDK1sp
"safe and holy, christine and the queens",spotify:track:63hIesjNbh0Ydl4TKM4cPc
"nuit 17 à 52, christine and the queens",spotify:track:1yNjs2dMriAHdL5zNU7OXl
"chaleur humaine, christine and the queens",spotify:track:5w0l7wpio347RsPzdJEsIc
"narcissus is back, christine and the queens",spotify:track:7yUzBfgSK6zO0qGkj6SnQ4
"doesn't matter, christine and the queens",spotify:track:4UH4lWuTEs9r8W0ZkJ5heS
"intranquillité, christine and the queens",spotify:track:3LY46JR7jcFNk9SDE5tz5c
"saint claude (version française), christine and the queens",spotify:track:5Ai8XBxieq1CR263UdhGdF
"it, christine and the queens",spotify:track:3qth4Wzm1QBGxkusVF8BaN
"paradis perdus, christine and the queens",spotify:track:7rUJX9xP2YcL62uJvtaeJd
"christine, christine and the queens",spotify:track:6tNDVXXaYWsBd3Mqhfelvl
"i disappear in your arms - bonus, christine and the queens",spotify:track:7k9L8N0jZcz9qFupVeI4Va
"tilted, christine and the queens",spotify:track:4U6GYrZi0xvNkUmFitCDED
"on ne meurt pas d'amour, clara luciani",spotify:track:4ovQY3yLU58scPdkK0IbkU
"so naïve, villagers",spotify:track:4MjRTKS6sJhHTof4U0uq18
"courage, villagers",spotify:track:0E9vvI2kGtr8TUW2kJmGX4
"darling arithmetic, villagers",spotify:track:62TlzoYO7kaQj1sox59Sno
"little bigot, villagers",spotify:track:1eLYjLMPj7UXzSks3IwnaN
"no one to blame, villagers",spotify:track:7ukf2Fu23rEOoPKbcrzGLh
"hot scary summer, villagers",spotify:track:2t5USj2lH8pPII6ox2Hch0
"the soul serene, villagers",spotify:track:6Ldzl8DVY21HvF50CYJioL
"everything i am is yours, villagers",spotify:track:281ioxkZbJ3p9hCvjD2bon
"dogwood blossom, fionn regan",spotify:track:1fkv8BNqfHePuLT8jdZNqT
"only you, yazoo",spotify:track:3UIXmHdXWroLttiNWNeDlz
"dog days are over, florence + the machine",spotify:track:1YLJVmuzeM2YSUkCCaTNUB
"breaking down, florence + the machine",spotify:track:2TYfPBSXeAJQgP1CpkXDUP
"girl with one eye, florence + the machine",spotify:track:0UdBCetwMDQO7JIhi7Waik
"bird song, florence + the machine",spotify:track:6EfZCB2wudriyD1vDjuAZ9
"hardest of hearts, florence + the machine",spotify:track:5Gf4tg1WJOzIw5iiOLBJzF
"long & lost, florence + the machine",spotify:track:5eSpqylqJdZPEX85nTGEVp
"too much is never enough, florence + the machine",spotify:track:3ikcPRWKVx5oSalVpLzQQu
"kiss with a fist, florence + the machine",spotify:track:0jv5OcbvTUHgO8FgHhya8b
"my boy builds coffins, florence + the machine",spotify:track:2ZdWa7qK1fe0dUSP6mJj4e
"all this and heaven too, florence + the machine",spotify:track:74GJoiemPE1VOyN9nVFs6k
"bedroom hymns, florence + the machine",spotify:track:5xJt5bwhmypiqHRVDjPGYH
"hurricane drunk, florence + the machine",spotify:track:1T0Kkq1Oio6nHVhenMQeDR
"june, florence + the machine",spotify:track:2yoaXLItTfWNpdFFpdF3Ti
"stand by me, florence + the machine",spotify:track:5XSU59wtE5CRCAEyHmmGy4
"blinding, florence + the machine",spotify:track:4tUOFydV4QoeqZOIoxzHNk
"falling, florence + the machine",spotify:track:3bENrkfntz1ugrsi8yzT9C
"third eye, florence + the machine",spotify:track:7Mz95vPtFlDGIiZ5d1XdT3
"shake it out - mtv unplugged, 2012, florence + the machine",spotify:track:2GMp7ZqMsBOnAVgTQOyPNB
"dog days are over - mtv unplugged, 2012, florence + the machine",spotify:track:1EWMC52f81plzO8HIHlO8q
"between two lungs, florence + the machine",spotify:track:5WnYyCWBbJyLChmd2sbZK9
"drumming song, florence + the machine",spotify:track:7yD1uhq8xqCSdHLSkQ6sYL
"i'm not calling you a liar, florence + the machine",spotify:track:3euILOYDltKArnqpupsE1W
"seven devils, florence + the machine",spotify:track:5qaLfqAUiqvsoL0l4T05Yx
"heartlines, florence + the machine",spotify:track:3w0Kw31MTI6NwWjCBJNUJk
"hiding, florence + the machine",spotify:track:6VVxlhDiGQeah3nPKStf2B
"no light, no light - mtv unplugged, 2012, florence + the machine",spotify:track:7BFab72CNred3EUfqXn3WA
"cornflake girl - recorded at rak studios, london, florence + the machine",spotify:track:0eJEcotVKze2Ioy4u0T7eR
"heavy in your arms, florence + the machine",spotify:track:3YZ4ccGSysav9mPqbni9JU
"lover to lover, florence + the machine",spotify:track:1LsZVVQxkbmL9izqfy1RRK
"south london forever, florence + the machine",spotify:track:3MZ7TxuXNnwYXm2KZGap5g
"rabbit heart (raise it up), florence + the machine",spotify:track:5RoLLyMmaEG4WiVMlp7r59
"breath of life, florence + the machine",spotify:track:5xze6PuNHYQhTWAPMSfDsB
"only if for a night, florence + the machine",spotify:track:3I4wuL82QeU3IR518TuV33
"howl, florence + the machine",spotify:track:3GS8qG28p2RF6M7S5rFdx5
"queen of peace, florence + the machine",spotify:track:4ZkGNzavB3e5mPpEP8HUjB
"hunger - recorded at rak studios, london, florence + the machine",spotify:track:1HwuSP4S2lun5IExwkCEOi
"what the water gave me, florence + the machine",spotify:track:3RiOPzAvhNKuMIdPYOrKV8
"how big, how blue, how beautiful, florence + the machine",spotify:track:7GlwvJ8iAbCEfZjGq3iwmZ
"big god, florence + the machine",spotify:track:1NcXkWB3UwXfMt8izByICb
"never let me go, florence + the machine",spotify:track:6cC9RY7MoUx5z3aHjDTNI6
"ship to wreck, florence + the machine",spotify:track:20NEld0MhrR4Zpgrf9brq8
"jenny of oldstones (game of thrones), florence + the machine",spotify:track:1u0THw5xaGd7sYzJEh48Lt
"sky full of song, florence + the machine",spotify:track:64fzn2ewOdSH57wrxTPGov
"delilah, florence + the machine",spotify:track:0fgSfUAnuJzzB8l8MdgRZg
"what kind of man, florence + the machine",spotify:track:1w9ta1CvXlJPRXh6Py2Mto
"no light, no light, florence + the machine",spotify:track:5nkYDYUSb1bvLJ4nP8CnQ1
"cosmic love, florence + the machine",spotify:track:0CSTvWUps1YmpQoXXay9ol
"living in a ghost town, the rolling stones",spotify:track:5RrrQhJKKKMJt3wB5n2N3t
"light of love, florence + the machine",spotify:track:3q8iHOd2icirSipnkE7fae
"spectrum (say my name) - calvin harris remix, florence + the machine",spotify:track:1c478uMN61yF2JOXXEtsdw
"hunger, florence + the machine",spotify:track:6Ju28M6P8Y8sLjBgWjyUUD
"shake it out, florence + the machine",spotify:track:4lY95OMGb9WxP6IYut64ir
"you've got the love, florence + the machine",spotify:track:6u9RqxALwkjJ1ukB1y8vuP
"homemade dynamite - remix, lorde",spotify:track:5u64RlrnvvbtNh6R0EMh6o
"perfect places, lorde",spotify:track:1qXjolYMICsnISl8xZAbA2
"liability (reprise), lorde",spotify:track:7kEN6uPEaCTATwQKagVcVE
"supercut, lorde",spotify:track:6IIcLzR05sN1gk4ngzz7Kk
"writer in the dark, lorde",spotify:track:5bMWY1u9ghi4X6fIAsQRaC
"sober ii (melodrama), lorde",spotify:track:0dtMnnWhm2AXVxjJy5hUPe
"hard feelings/loveless, lorde",spotify:track:3VDX4CCJWbRXBKuW5IY5R9
"the louvre, lorde",spotify:track:4YBDSEzVNQbvCvVIWNtruF
"homemade dynamite, lorde",spotify:track:0zL76omZWytdTtyXKVfuDw
"sober, lorde",spotify:track:0PXCdhnm9fRgrIgoMcteZa
"a world alone, lorde",spotify:track:55N0YHhO55Q1lWsc4dDPcI
"white teeth teens, lorde",spotify:track:35kahykNu00FPysz3C2euR
"still sane, lorde",spotify:track:5TRZnGsX49uCZkXxIbD7Ru
"glory and gore, lorde",spotify:track:60jI0JgMLLj1VggHJVhtRs
"buzzcut season, lorde",spotify:track:51QEyJI5M7uyd8DOh9tqQY
"400 lux, lorde",spotify:track:6rjtB7KSIiJ6v9vrACMlqF
"tennis court, lorde",spotify:track:74fpNVAJrKGQuqHETi4WSt
"liability, lorde",spotify:track:6Kkt27YmFyIFrcX3QXFi2o
"green light, lorde",spotify:track:6ie2Bw3xLj2JcGowOlcMhb
"ribs, lorde",spotify:track:2MvvoeRt8NcOXWESkxWn3g
"team, lorde",spotify:track:3G6hD9B2ZHOsgf4WfNu7X1
"royals, lorde",spotify:track:2dLLR6qlu5UJ5gk0dKz0h3
"yellow flicker beat, lorde",spotify:track:0Nf53RDPZEjFrQE4B5n6Vf
"isolation, jeff beck",spotify:track:2yoZimUShwEoCsXEfmRGNV
"souvenir - radio edit, feu! chatterton",spotify:track:2P5Y8kEmwwoeFgO9maRLgp
"tu m'avais dit - acoustic version, alice et moi",spotify:track:3Rknbh3F8jGlF8r9dado3F
"love me do - remastered 2009, the beatles",spotify:track:3VbGCXWRiouAq8VyMYN2MI
"the kids are alright, the who",spotify:track:4zJBF8rXepeoJ0qJOqMLhj
"we gotta get out of this place - uk single version, the animals",spotify:track:5geF5xzPGHxpmk9BDBHphZ
"with a girl like you, the troggs",spotify:track:3VGBUfN2EOVHJ4Y92yIh2f
"a whiter shade of pale - original single version, procol harum",spotify:track:78ZqE2tjAxbqEGGlvGnQfT
"strange brew, cream",spotify:track:3ET8TZWF5sP4SPfJK1lKun
"gloria (feat. van morrison) - stereo version, them",spotify:track:1DKyFVzIh1oa1fFnEmTkIl
"time of the season - mono version, the zombies",spotify:track:5AJrhrwz4oSZX2PwwV4qrN
"i wanna be your man - mono, the rolling stones",spotify:track:2gQkEvBvRlwm6iQxC0fkE4
"bus stop, the hollies",spotify:track:3Jw2A9SC8zhntx4ON9VabX
"it's my life, the animals",spotify:track:7yGR8R1HgQJeW6s3KRuyGS
"i feel free, cream",spotify:track:62nYkaIBesfvQSSwTjPnYS
"it's good to be king, tom petty",spotify:track:1c0flvMImhKMuiZIc0VzEb
"saving grace, tom petty",spotify:track:1fx892FhPzDsp8UVv0BGVj
"elegie, patti smith",spotify:track:1s20rDPeaWhdDRZGVXOlb2
"land: horses / land of a thousand dances / la mer(de), patti smith",spotify:track:0KkXMzaRaXL8AyChkWbYCx
"break it up, patti smith",spotify:track:5UoBmpb4VHNBbKjxmL8WGe
"kimberly, patti smith",spotify:track:0iI8LriXKjg47IxjNCWuwz
"free money, patti smith",spotify:track:1wP1qnWy0cZWxnbWkzf9La
"birdland, patti smith",spotify:track:4UcCvuacrweynfWohap8NR
"redondo beach, patti smith",spotify:track:6zCBk93V8M7fPriZj9i4dd
"gloria: in excelsis deo, patti smith",spotify:track:272Z4tzaSMMcgrZ0R494S2
"daddy long legs, midnight sister",spotify:track:0hPrCD9AkQ85ofQrfaRFgG
"blue cigar, midnight sister",spotify:track:7Gjam2xvI8zOIKUf7blzi0
"about her, malcolm mclaren",spotify:track:0WN1ICX0u0NenOccX8gRp3
"make you mine, public",spotify:track:0xv503ojmZFWr6n4HgXBYW
"dondante, my morning jacket",spotify:track:4TIONK6tnZWlNl5HdKpWby
"louise, the velvet underground",spotify:track:6uHeiOu6GTXFaHWHGqmUp0
"i'm gonna move right in, the velvet underground",spotify:track:6xCy0YfuaplQ6owztn6D6b
"one of these days, the velvet underground",spotify:track:47PentxCa073FNgE4sNVCr
"get on top, tim buckley",spotify:track:2OqesAvEfzM5KvBHhRlz5l
"dolphins - remastered, tim buckley",spotify:track:0tvepqOHxqKt2PYRcLTHRR
"sweet surrender, tim buckley",spotify:track:42AO7bZPlJIxAbbn81k4kw
"pleasant street, tim buckley",spotify:track:1L8n3DR0g5w36X51i2k8A4
"sing a song for you, tim buckley",spotify:track:01o6YGrdvMrUAFmWgwoDCb
"song to the siren - take 7, tim buckley",spotify:track:5ckwOX7SVzt9OISbGkD299
"buzzin' fly, tim buckley",spotify:track:3Xy16SYnhBiSBL5yUXaHG1
"song to the siren, tim buckley",spotify:track:5s5N8kSizrNMAhcCvFnYjg
"désert désir (spitzer remix), grand blanc",spotify:track:3YmSuzkpw5hDfmmV4c9aLj
"evidence (molecule remix), grand blanc",spotify:track:6Aqcgp1DGo4cjIMKNmtxi5
"ailleurs - edit, grand blanc",spotify:track:17SNswMd5SsxcYJmbX0Lx3
"los angeles, grand blanc",spotify:track:1SrMihACqwxk4fIGOIUbYS
"montparnasse, grand blanc",spotify:track:3e21BAJLKPFzmrVsSyhgPq
"l'homme serpent, grand blanc",spotify:track:0VUzBOSDzWj7pUonicaeep
"summer summer, grand blanc",spotify:track:7oMw0xvv76DFdvnPSSSGj3
"disque sombre, grand blanc",spotify:track:2NiKa1imnItnXPf0KK21XV
"télévision, grand blanc",spotify:track:5yhOQSbRP8Msk9c0Ata8Vj
"rêve bb rêve, grand blanc",spotify:track:2u8SBvgmR0BUDKpU5xI4rk
"image au mur, grand blanc",spotify:track:74IWXZMc9oMcYTJEgJERIL
"des gens bien, grand blanc",spotify:track:69OwNzQ27PBh64RkkD2zcL
"isati, grand blanc",spotify:track:6fK6m1D6uREJuFwEnVo7YI
"l'amour fou, grand blanc",spotify:track:4JvGQUcFf17aDeJJuNAiZf
"sitôt, alex beaupain",spotify:track:47N4GLAQwudCP1JJMPCD50
"drôle d'époque, clara luciani",spotify:track:3tTwH5Ut4S1LuTRKUTcj1O
"qu'est ce qu'on y peut ?, pierre lapointe",spotify:track:7d0NNbdPcgbJtwjndKy269
"mon ombre, clara luciani",spotify:track:4PIaJuqgruXdcgFAxc2u66
"à crever, clara luciani",spotify:track:71OstTpEUSzqwCa5nUKGbE
"eddy, clara luciani",spotify:track:4o7h3cDkhTqk3cUhDfju8c
"pleure clara, pleure, clara luciani",spotify:track:4wANLVRn4s0FqYuvwM0UMh
"bovary, clara luciani",spotify:track:73V7shRcNsEQ4SpTgYFFB0
"qu'est-ce que t'es beau, clara luciani",spotify:track:7fR23zj47csX8nlOhqlJ4B
"la chanson de delphine, clara luciani",spotify:track:61OuVGRWNDJcmKy9LI28u9
"les fleurs, clara luciani",spotify:track:6jypQiNeBTQM80iuSkoNsS
"la baie, clara luciani",spotify:track:5awqGLNiSTNRtMtWve1bSA
"ma sœur, clara luciani",spotify:track:1DCJJCT2TwJO1OxZ9E7px9
"nue, clara luciani",spotify:track:3rfDjFBGWeDW88inQfLzmm
"la grenade, clara luciani",spotify:track:7ixCRBD0FZMRBeOBhTu2KD
"c'est de la frénésie, alice et moi",spotify:track:6IZIgRY0OzWm8bxbrxIdDR
"t'es fait pour me plaire, alice et moi",spotify:track:48DOsX7WRDVKbnnGeCzaZp
"filme moi, alice et moi",spotify:track:7f8ep7LmhUvhEIvlDfb9cj
"l'oiseau, feu! chatterton",spotify:track:7wTE6zKPCgCZiByuAxSUNV
"la malinche, feu! chatterton",spotify:track:1m0VhCjfqRal5e11Ill3fM
"prettiest virgin, agar agar",spotify:track:5gusADrGCRfFSewILLmGP6
"you're high, agar agar",spotify:track:3Wtm09sSjyoidTrms6H4H6
"maddy la nuit, flavien berger",spotify:track:1uqcwvZ8COoq85XOksYyhK
"brutalisme, flavien berger",spotify:track:1dzoPsCEYvZCqhtTNFDccd
"les héros de barbès, juniore",spotify:track:57aGeek8XirEyPG5j9n9r1
"ah bah d’accord, juniore",spotify:track:07efUwZTg2blJ6AKqCccUG
"je fais le mort, juniore",spotify:track:6QqUx8J1CV5c79lT4ox5Te
"a la plage, juniore",spotify:track:1Z4w6YamUv4sYZCf8nPT8N
"feu rouge, pépite",spotify:track:314LZAYaJXobwhsUapt0nJ
"pli du cœur, the pirouettes",spotify:track:0uSOu4919yU96bfiZT16lL
"dernier métro, the pirouettes",spotify:track:5FZRR268149VwP5u9nzIez
"jouer le jeu, the pirouettes",spotify:track:6wakU2PSuIbh8X04du27li
"l'escalier, the pirouettes",spotify:track:4dVcaqqxV7alre6c1vRoik
"now that you're gone, camp claude",spotify:track:5QXW8O2ux5EWKwP1EDte5o
"swimming lessons, camp claude",spotify:track:22r5S6iwB1Le5qpIFMSm48
"dancing alone, camp claude",spotify:track:0HOR3INs7Q74RCDy2a9lL6
"old downtown, camp claude",spotify:track:07J5gvVBcXUPcsa9KVYwHu
"lille, voyou",spotify:track:4Jd8CmtOFzB8tePfOius35
"la serre, voyou",spotify:track:7y2PcB3cCmuKS9epz4UJEt
"à nos jeunesses, voyou",spotify:track:0BhEZmG2sBnV6Tn4GggNdN
"le naufragé, voyou",spotify:track:7Kg0UHhhjcwgXMRnaM2X4u
"le confort, voyou",spotify:track:4qtZpUJ5nJOiqvYIhS65Ov
"y crois-tu, fishbach",spotify:track:6qz58Ewm182HRXyuKlcnbj
"dans une boîte en papier, fishbach",spotify:track:1ILFpk6zb8ZLHwn94ePrSA
"à ta merci, fishbach",spotify:track:3mBIjrgRfZCUSZhILW2LK0
"le château, fishbach",spotify:track:3af4kSHY0qD5s29ibc0WE7
"invisible désintégration de l'univers, fishbach",spotify:track:3DuusRj1j5hke6pqn3ktWX
"un autre que moi, fishbach",spotify:track:6k7BWoUAjyguOjRNewRFdQ
"ma voie lactée, fishbach",spotify:track:0mfV4tGUred3BXFkI8MeC6
"mortel, fishbach",spotify:track:47NipxlZzqAoe3ndnuG1rw
"femme fatale, the velvet underground",spotify:track:3PG7BAJG9WkmNOJOlc4uAo
"cheri cheri lady, modern talking",spotify:track:5pHVEIn2RwZQn38qIfB3Rz
"at least that's what you said, wilco",spotify:track:63fKR9muo3uUwlFwlwZLG1
"unfucktheworld, angel olsen",spotify:track:0HaDqyNg9LoZZ7Zli1uhzL
"oh babe what would you say, hurricane smith",spotify:track:2LY6g95pnSwCFG6TBKiZwv
"i found a reason - 2015 remaster, the velvet underground",spotify:track:63OJHHu2ambZAvdrvhdT2b
"satellite of love - demo version; 2015 remaster, the velvet underground",spotify:track:6NkzKmPgDTG8zHL7PtydBh
"i can't stand it, the velvet underground",spotify:track:2U7ZghsBnEc4BYTGbZor4L
"friends, the velvet underground",spotify:track:4wvBkjKpTnIUEvkBQeE41z
"sad song - demo version; 2015 remaster, the velvet underground",spotify:track:7uMDNeWshPiqZQFoNa8h1U
"achilles last stand - 1990 remaster, led zeppelin",spotify:track:5gwign6hATXgMHxYrRix9L
"voilà, françoise hardy",spotify:track:6aRy3XEJMq9SeZKz2pV9q4
"i put a spell on you, nina simone",spotify:track:0sjxRg1VlYfx4YG7uxurrq
"my baby's gone, the ravens",spotify:track:5SKBSRMWVXLw1hkpVqaTci
"i put a spell on you, screamin' jay hawkins",spotify:track:1YwoYPfhuZlLDbJUH1cKSi
"take me out, young summer",spotify:track:0P02sJx08rbprBFPgNDJ8R
"with arms outstretched, rilo kiley",spotify:track:5p3UmXrTYD95gJjDLdM82x
"orange sky, kat cunning",spotify:track:45E6I2yNGDGkEqx2U2PWvs
"crosses, josé gonzález",spotify:track:7Af2gX0MJD9F5TJSeJEhXC
"ask me anything, the strokes",spotify:track:3CixrF3nYZ6V5OwFKSQxuM
"i'm sticking with you, the velvet underground",spotify:track:1iJiJfFkhwpSh1m8qTgZ5A
"dopey joe, the velvet underground",spotify:track:7cULGoJDYM7lGJAmlDq4dw
"stephanie says, the velvet underground",spotify:track:341b9JIDHZ3oaMVNwS0OsA
"andy's chest, the velvet underground",spotify:track:4oHGcw4VE6hOo2rLFOXWmT
"season of the witch, lana del rey",spotify:track:5DSi7heBC8eTIFROBvttnp
"lisa says - live, the velvet underground",spotify:track:0duMbGXhMqiUX5LrY1u9Kq
"she's my best friend, the velvet underground",spotify:track:29pebZ4rseuBYTImTX4aJq
"foggy notion, the velvet underground",spotify:track:1g4MLkHenJtT7WeIv1SZuk
"hey jude, the beatles",spotify:track:1eT2CjXwFXNx6oY5ydvzKU
"one vision - remastered 2011, queen",spotify:track:0xzhryP1AoHUazYdJ5rj3B
"friends will be friends - remastered 2011, queen",spotify:track:0SaopEgTo6O5dJoFXBbulL
"dream a little dream of me (with paul weston & his music from hollywood), doris day",spotify:track:2HyPrPSANTIPkR6CfiytwY
"fuck it i love you, lana del rey",spotify:track:7MtVPRGtZl6rPjMfLoI3Lh
"love song, lana del rey",spotify:track:5tyMJlMqaggzvuX7TtlrTe
"mambo sun - remastered, t. rex",spotify:track:79dQwpXjJ4t3pILysdqFyB
"ain't no mountain high enough, eddie money",spotify:track:70PGLsqrzgRAp19n6sTvOM
"sixteen, iggy pop",spotify:track:70ZlAJGfC4DesFw4oQ7YZM
"ooh la la - 2015 remaster, faces",spotify:track:6TNNMVpOgn8K5NoDC7alG6
"gimme some lovin' - single mix, the spencer davis group",spotify:track:0g6UcrVsACnRJyTGX6uSHu
"everyday - single version, buddy holly",spotify:track:5MMU5J8jtVDZiryukBeruJ
"i feel fine - remastered 2009, the beatles",spotify:track:4gxs9En3aoaOm2J5wNMMm9
"surf city - remastered 1990/stereo remix, jan & dean",spotify:track:4ZzXPeOfMXk0iKNQGdlzDq
"crying, roy orbison",spotify:track:6eLL7QTdMWdhhG4i3jHDR9
"runaround sue, dion",spotify:track:1DndHckdH9m5rp6gYP086b
"oh, pretty woman, roy orbison",spotify:track:48i055G1OT5KxGGftwFxWy
"surfin' u.s.a. - remastered, the beach boys",spotify:track:0wz1LjDb9ZNEYwOmDJ3Q4b
"i get around (mono), the beach boys",spotify:track:3v9xlH6BpmRbqL7hgNJhfT
"hey jude - remastered 2015, the beatles",spotify:track:0aym2LBJBk9DAYuHHutrIl
"it's only love - remastered 2009, the beatles",spotify:track:2ue1KRstSKHF8jQkIJZiNC
"over you - live, the velvet underground",spotify:track:2chcBZsDQlN5sjoAkdaD28
"supergirl, reamonn",spotify:track:3FhNJaCNypOAnZccdYGAWN
"give me love, ed sheeran",spotify:track:0SuG9kyzGRpDqrCWtgD6Lq
"skinny love, birdy",spotify:track:4RL77hMWUq35NYnPLXBpih
"lucy in the sky with diamonds - remastered 2009, the beatles",spotify:track:25yQPHgC35WNnnOUqFhgVR
"strawberry fields forever - remastered 2009, the beatles",spotify:track:3Am0IbOxmvlSXro7N5iSfZ
"what i'd say (remastered), ray charles",spotify:track:6RvJigkrHaxStGN2shMJ7h
"i only wanna be with you, bay city rollers",spotify:track:3XY0oIVf2roUFIwkzjBgwt
"satisfied mind - live at wfmu, east orange, nj - oct 1992, jeff buckley",spotify:track:59J9tAbY39foKp478aUsWX
"morning theft, jeff buckley",spotify:track:4dYrMJkjysQFCjSbNCzZdz
"if you knew - live at sin-é, new york, ny - july/august 1993, jeff buckley",spotify:track:1nd2JEHXbUuQFDiQzCBpsv
"fox on the run, manfred mann",spotify:track:0oxQWfkZuJW8L7uiItwsB0
"pretty flamingo, manfred mann",spotify:track:1UgKjjafmYDSgJ66NbIcBV
